{
  "id": "aud-0000000000000c03",
  "schemaVersion": "v3-audit-log-entry/0.1",
  "timestamp": "2026-06-10T10:43:00Z",
  "tenant": "acme",
  "workspace": "legal",
  "actor": {
    "id": "svc.connector",
    "role": "service"
  },
  "action": {
    "type": "connector-fetch",
    "target": "sharepoint/contracts",
    "serviceMode": "private",
    "dataClass": "secret",
    "publicEgress": false
  },
  "evidenceId": "ev-0000000000000c04",
  "policyDecision": "deny",
  "approvalChain": [],
  "redaction": {
    "storesDocumentContent": false,
    "promptStorage": "none",
    "hashAlgorithm": "sha256"
  },
  "chain": {
    "algorithm": "sha256",
    "previousHash": "2222222222222222222222222222222222222222222222222222222222222222",
    "entryHash": "3333333333333333333333333333333333333333333333333333333333333333"
  }
}
