{
  "id": "aud-0000000000000c02",
  "schemaVersion": "v3-audit-log-entry/0.1",
  "timestamp": "2026-06-10T10:41:00Z",
  "tenant": "acme",
  "workspace": "legal",
  "actor": {
    "id": "user.li",
    "role": "user"
  },
  "action": {
    "type": "patch-apply",
    "target": "writer.diff-review",
    "serviceMode": "private",
    "dataClass": "confidential",
    "publicEgress": false
  },
  "evidenceId": "ev-0000000000000c02",
  "policyDecision": "require-approval",
  "approvalChain": [
    {
      "approverId": "admin.chen",
      "decision": "approved",
      "timestamp": "2026-06-10T10:42:00Z",
      "evidenceId": "ev-0000000000000c03"
    }
  ],
  "redaction": {
    "storesDocumentContent": false,
    "promptStorage": "hash-only",
    "hashAlgorithm": "sha256"
  },
  "chain": {
    "algorithm": "sha256",
    "previousHash": "1111111111111111111111111111111111111111111111111111111111111111",
    "entryHash": "2222222222222222222222222222222222222222222222222222222222222222"
  }
}
